province,url,Content
Hồ Chí Minh,https://vnexpress.net/cam-nang-du-lich-tp-hcm-4608205.html,TP HCM là nơi hội tụ nhiều nền văn hóa; với các sản phẩm du lịch đa dạng; là  với những hoạt động vui chơi; giải trí sôi động cả ngày lẫn đêm.
Hồ Chí Minh,https://vnexpress.net/cam-nang-du-lich-tp-hcm-4608205.html,TP HCM nằm trong vùng nhiệt đới gió mùa cận xích đạo. Đặc điểm chung của thời tiết ở đây là nhiệt độ cao đều trong năm; có hai mùa mưa và khô rõ rệt. Mùa mưa từ tháng 5 đến tháng 11; mùa khô từ tháng 12 đến tháng 4. Nhiệt độ trung bình khoảng 27 độ C; cao nhất lên hơn 40 độ C nhưng đa phần nắng không gay gắt; độ ẩm thấp; dịu mát về chiều tối. Nắng nóng không khắc nghiệt như thời tiết miền Bắc; nên du khách có thể ghé thăm thành phố bất kể thời điểm nào trong năm. Nếu đến vào mùa mưa; nên chuẩn bị ô để tránh những cơn mưa rào bất chợt.
Hồ Chí Minh,https://vnexpress.net/cam-nang-du-lich-tp-hcm-4608205.html,Là thành phố lớn nên việc di chuyển đến TP HCM thuận tiện; với đầy đủ phương tiện giao thông gồm máy bay; tàu hỏa; tàu biển; ôtô... Các hãng hàng không nội địa đều khai thác chuyến bay thẳng đến sân bay Tân Sơn Nhất từ nhiều địa phương mỗi ngày. TP HCM là nơi có các chuyến đi và đến có tần suất lớn nhất cả nước. Giá vé khứ hồi từ đến TP HCM dao động từ 2 đến 4 triệu đồng; tùy nơi xuất phát và thời điểm mua vé.
Hồ Chí Minh,https://vnexpress.net/cam-nang-du-lich-tp-hcm-4608205.html,Sân bay Tân Sơn Nhất nằm ở quận Tân Bình; cách trung tâm (quận 1) khoảng 8 km; cách quận 3 và quận Phú Nhuận khoảng 5 km. Hiện giá taxi truyền thống từ sân bay Tân Sơn Nhất vào trung tâm khoảng 250.000 đồng.
Hồ Chí Minh,https://vnexpress.net/cam-nang-du-lich-tp-hcm-4608205.html,Du khách có thể đặt xe công nghệ với mức giá bằng một nửa (không phải giờ cao điểm). Một trong những kinh nghiệm là đi bộ đến ga quốc tế đặt xe sẽ nhanh hơn so với chờ ở ga quốc nội. Với tàu hỏa; tàu Thống Nhất nhanh nhất nối Hà Nội và TP HCM hiện là 30 tiếng; dừng ở các ga lớn như Vinh - Đồng Hới - Huế - Đà Nẵng. Du khách nên đặt vé tại đại lý uy tín hoặc trực tiếp qua trang dsvn.vn; chọn ga đi và ga đến; loại ghế ngồi hoặc giường nằm theo nhu cầu.
Hồ Chí Minh,https://vnexpress.net/cam-nang-du-lich-tp-hcm-4608205.html,Giá vé tàu khác nhau tùy theo khoang; loại ghế.
Hồ Chí Minh,https://vnexpress.net/cam-nang-du-lich-tp-hcm-4608205.html,Đường bộ nối miền Nam và miền Bắc có hai tuyến chính: quốc lộ 1A và đường mòn Hồ Chí Minh.
Hồ Chí Minh,https://vnexpress.net/cam-nang-du-lich-tp-hcm-4608205.html,Tùy theo nhu cầu; các điểm đến trên hành trình mà du khách lựa chọn tuyến đường phù hợp. Việc đi lại trong thành phố thuận tiện; có nhiều phương tiện giao thông.
Hồ Chí Minh,https://vnexpress.net/cam-nang-du-lich-tp-hcm-4608205.html,Thuê xe máy là một trong những lựa chọn phổ biến nhất. Hầu hết điểm lưu trú đều hỗ trợ cho thuê xe; hoặc tìm thuê theo địa chỉ trên mạng; phổ biến ở khu vực trung tâm.
Hồ Chí Minh,https://vnexpress.net/cam-nang-du-lich-tp-hcm-4608205.html,Giá thuê một ngày tùy loại xe; dao động 100.000-200.000 đồng. Một số nơi sẽ yêu cầu khách đặt cọc 1 đến 4 triệu đồng; có nơi chỉ cần lưu lại giấy tờ tùy thân. Ngoài ra; di chuyển bằng xe công nghệ (ôtô hoặc xe máy) ở TP HCM cũng là lựa chọn thuận tiện.
Hồ Chí Minh,https://vnexpress.net/cam-nang-du-lich-tp-hcm-4608205.html,Tuy nhiên; nếu di chuyển liên tục; sẽ tốn kém.
Hồ Chí Minh,https://vnexpress.net/cam-nang-du-lich-tp-hcm-4608205.html,Phương tiện công cộng là lựa chọn hợp lý khi muốn tiết kiệm chi phí.
Hồ Chí Minh,https://vnexpress.net/cam-nang-du-lich-tp-hcm-4608205.html,Du khách có thể chọn xe buýt hoặc xe đạp công cộng (với khu trung tâm).
Hồ Chí Minh,https://vnexpress.net/cam-nang-du-lich-tp-hcm-4608205.html,Xe đạp công cộng khai trương tháng 12/2021.
Hồ Chí Minh,https://vnexpress.net/cam-nang-du-lich-tp-hcm-4608205.html,Các điểm đặt xe được bố trí trên vỉa hè nhiều tuyến đường tại quận 1; gần các trạm dừng; nhà chờ xe buýt; công viên; điểm du lịch...
Hồ Chí Minh,https://vnexpress.net/cam-nang-du-lich-tp-hcm-4608205.html,với giá 5.000 đồng cho 30 phút và 10.000 đồng cho 60 phút.
Hồ Chí Minh,https://vnexpress.net/cam-nang-du-lich-tp-hcm-4608205.html,Dịch vụ lưu trú tại TP HCM đa dạng với hệ thống khách sạn; homestay; căn hộ dịch vụ; đáp ứng nhu cầu của du khách.
Hồ Chí Minh,https://vnexpress.net/cam-nang-du-lich-tp-hcm-4608205.html,Có thể tìm được phòng nghỉ với mức giá từ vài trăm nghìn đến hàng chục triệu đồng một đêm. Có nhiều khách sạn 5 sao mức giá khoảng 3-7 triệu đồng như Park Hyatt Sài Gòn; Hotel Majestic Saigon; Hotel des Arts Saigon; Pullman Saigon Centre; Hotel Nikko Saigon; Norfolk Mansion; La Vela Saigon. Ở phân khúc tầm trung 1-2 triệu đồng; du khách có thể tham khảo các khách sạn như Wink Hotel Saigon Centre; La Memoria Hotel; The Hammock Hotel Ben Thanh; Millennium Boutique Hotel; The Odys Boutique Hotel. Căn hộ dịch vụ với đầy đủ tiện nghi như căn hộ thông thường nhưng được trang trí đẹp mắt phù hợp nhu cầu du lịch.
Hồ Chí Minh,https://vnexpress.net/cam-nang-du-lich-tp-hcm-4608205.html,Một số địa chỉ du khách có thể tham khảo gồm Ariosa; The Bloom; City Oasis; S Home; M Village Boutique. Các căn hộ dịch vụ có mức giá từ 800.000 đồng đến 2 triệu đồng. Homestay có mức giá chưa đến 1 triệu đồng mỗi phòng.
Hồ Chí Minh,https://vnexpress.net/cam-nang-du-lich-tp-hcm-4608205.html,Một số địa chỉ homestay ở trung tâm có thể kể đến Nấp Saigon; Home; Hostie Saigon Wanderlust Home; Cactusland Homestay; Zooz Studio.
Hồ Chí Minh,https://vnexpress.net/cam-nang-du-lich-tp-hcm-4608205.html,Ngoài ra; còn có nhiều nhà nghỉ bình dân khác.
Hồ Chí Minh,https://vnexpress.net/cam-nang-du-lich-tp-hcm-4608205.html,Du khách có thể tham khảo đặt phòng tại Agoda hay Booking.
Hồ Chí Minh,https://vnexpress.net/cam-nang-du-lich-tp-hcm-4608205.html,Du lịch TP HCM định hướng mỗi quận; huyện có một sản phẩm du lịch. Thành phố hội tụ đa dạng hoạt động giải trí; khu vui chơi; tham quan; mua sắm phù hợp nhiều đối tượng khách. Đi buýt đường sông Các trải nghiệm trên sông là một đặc trưng của du lịch TP HCM. Du khách được ngắm thành phố từ một góc nhìn khác; qua nhiều địa danh nổi tiếng như bến Nhà Rồng; cảng Bến Nghé; cầu Phú Mỹ; mũi Đèn Đỏ; bến phà Bình Khánh. Buýt sông khởi hành hàng ngày từ 8h30 tại bến Bạch Đằng; Bình An; Linh Đông; Thanh Đa; Hiệp Bình Chánh.
Hồ Chí Minh,https://vnexpress.net/cam-nang-du-lich-tp-hcm-4608205.html,Tuyến buýt đêm xuất phát muộn nhất lúc 22h.
Hồ Chí Minh,https://vnexpress.net/cam-nang-du-lich-tp-hcm-4608205.html,Vé có thể đặt online hoặc mua trực tiếp tại bến với giá 15.000 đồng một lượt. Ăn tối trên du thuyền Du thuyền khởi hành mỗi tối từ cảng Sài Gòn; đưa khách tham quan dọc sông; ngắm vẻ đẹp về đêm của bến Nhà Rồng; cảng Bến Nghé; cầu Sài Gòn; toà nhà Landmark 81... Du khách có thể trải nghiệm ăn tối trên du thuyền; thưởng ngoạn cảnh đẹp dọc bờ sông; với giá vé từ 350.000 đồng đến hơn một triệu đồng; tùy loại du thuyền.
Hồ Chí Minh,https://vnexpress.net/cam-nang-du-lich-tp-hcm-4608205.html,Bữa ăn tự chọn phong cách Á - Âu hoặc theo combo.
Hồ Chí Minh,https://vnexpress.net/cam-nang-du-lich-tp-hcm-4608205.html,Du thuyền còn có chương trình nghệ thuật; biểu diễn ca múa nhạc; ảo thuật. Ngoài ra; du khách có thể bao trọn du thuyền loại nhỏ; với sức chứa khoảng 20 người; giá từ 10 triệu đến 25 triệu đồng.
Hồ Chí Minh,https://vnexpress.net/cam-nang-du-lich-tp-hcm-4608205.html,Ngắm cảnh từ xe buýt hai tầng Trung tâm thành phố có xe buýt 2 tầng mui trần. Xe có hệ thống thuyết minh đa ngôn ngữ tự động hướng dẫn về các địa điểm trên đường; bản đồ du lịch; wifi miễn phí; hướng dẫn viên. Mỗi chuyến dài khoảng 60 phút; qua những địa điểm nổi tiếng như Thảo Cầm Viên; bảo tàng Chứng tích chiến tranh; phố đi bộ Bùi Viện; chợ Bến Thành; phố đi bộ Nguyễn Huệ; nhà hát thành phố và kết thúc bằng trải nghiệm ngắm thành phố từ trên cao tại Saigon Skydeck tầng 49 toà tháp Bitexco Financial Tower.
Hồ Chí Minh,https://vnexpress.net/cam-nang-du-lich-tp-hcm-4608205.html,Xe hoạt động từ 9h đến 22h30 hằng ngày; mỗi 30 phút sẽ có một chuyến. Buổi tối; xe cung cấp thêm gói dịch vụ ăn tối trên du thuyền cao cấp dọc sông Sài Gòn.
Hồ Chí Minh,https://vnexpress.net/cam-nang-du-lich-tp-hcm-4608205.html,Có thể mua vé trực tiếp tại quầy ở điểm xuất phát 92-96 Nguyễn Huệ; quận 1 hoặc đặt online.
Hồ Chí Minh,https://vnexpress.net/cam-nang-du-lich-tp-hcm-4608205.html,Dạo bộ trong công viên Thảo Cầm Viên tồn tại hơn 150 năm; là vườn thú có tuổi thọ hàng thứ 8 trên thế giới. Ban đầu nơi đây là vườn bách thảo; phục vụ các hoạt động bảo tồn động thực vật cho người dân thành phố; là nơi nghiên cứu của các nhà khoa học.
Hồ Chí Minh,https://vnexpress.net/cam-nang-du-lich-tp-hcm-4608205.html,Hiện Thảo Cầm Viên có hơn 1.000 cá thể động vật; hơn 2.000 cây gỗ thuộc 260 loài; 23 loài lan nội địa; 33 loài xương rồng trên diện tích 17 ha.
Hồ Chí Minh,https://vnexpress.net/cam-nang-du-lich-tp-hcm-4608205.html,Khuôn viên nơi đây trong lành; thích hợp cho các buổi thư giãn.
Hồ Chí Minh,https://vnexpress.net/cam-nang-du-lich-tp-hcm-4608205.html,Ngoài ra; TP HCM còn nhiều công viên và không gian xanh đẹp như Tao Đàn; Hoàng Văn Thụ; Lê Văn Tám; Gia Định. Nghe nhạc sống Nhâm nhi một tách cà phê hay một ly rượu và thưởng thức nhạc sống là một trong những trải nghiệm ở TP HCM; đặc biệt vào buổi tối. Những không gian biểu diễn nhạc sống từ lâu đã thu hút đông đảo người địa phương và du khách. Vào buổi tối; tại mỗi nơi là một gu âm nhạc riêng; từ rock sôi động; cho đến jazz ngẫu hứng; acoustic nhẹ nhàng hay những bản tình ca sâu lắng.
Hồ Chí Minh,https://vnexpress.net/cam-nang-du-lich-tp-hcm-4608205.html,Một số địa chỉ gợi ý: phòng trà Bến Thành; We; Không Tên; Đồng Dao. Quán bar hay cà phê acoustic: Yoko Cafe; Rock Fan Club; Sax N’ Art Jazz Club; Acoustic Bar; Drinking & Healing; Vừng.
Hồ Chí Minh,https://vnexpress.net/cam-nang-du-lich-tp-hcm-4608205.html,Trải nghiệm phố Tây Người địa phương và du khách quen gọi khu vực Bùi Viện - Đề Thám - Phạm Ngũ Lão; quận 1 là phố Tây; hoạt động từ chiều tối đến rạng sáng hôm sau.
Hồ Chí Minh,https://vnexpress.net/cam-nang-du-lich-tp-hcm-4608205.html,Tuyến phố bao gồm những tiện ích công cộng miễn phí như nhà vệ sinh; kết nối wifi và trạm cung cấp thông tin du lịch. Khu phố phù hợp với giới trẻ; khách du lịch; đặc biệt là khách Tây. Hàng trăm quán cà phê; bar; pub và hàng ăn uống dọc hai bên phố; luôn tạo không khí sôi động. Phố còn nhiều điểm bán tour du lịch.
Hồ Chí Minh,https://vnexpress.net/cam-nang-du-lich-tp-hcm-4608205.html,Khám phá cuộc sống và ẩm thực phố người Hoa Khu phố người Hoa bao gồm các quận 5; 6 và 11; nhưng sầm uất và được nhiều người biết đến nhất là quận 5.
Hồ Chí Minh,https://vnexpress.net/cam-nang-du-lich-tp-hcm-4608205.html,Dọc các con đường Trần Hưng Đạo; Châu Văn Liêm; Lương Nhữ Học... du khách sẽ được ngắm những dãy nhà cổ đậm nét kiến trúc Hoa có tuổi đời khoảng 100 năm. Tại đây cũng có nhiều ngôi chùa cổ; hội quán; các nhà hàng tiêu biểu của người Hoa.
Hồ Chí Minh,https://vnexpress.net/cam-nang-du-lich-tp-hcm-4608205.html,Các món ăn không thể bỏ qua có vịt quay; phá lấu; cá viên cà ri; mì kéo; gà tiềm; dimsum...
Hồ Chí Minh,https://vnexpress.net/cam-nang-du-lich-tp-hcm-4608205.html,Phố đèn lồng Lương Nhữ Học là một trong những điểm hấp dẫn vào dịp Trung thu; đặc biệt vào buổi tối khi đèn lồng đủ sắc màu và kiểu dáng tạo cho con phố vẻ đẹp lung linh. Phố Đông y cũng là địa điểm làm nên hình ảnh đặc trưng tại đây. Từ lâu; các thương gia người Hoa đã vận chuyển dược liệu sang buôn bán và dần hình thành khu phố bán dược liệu sầm uất như hiện nay.
Hồ Chí Minh,https://vnexpress.net/cam-nang-du-lich-tp-hcm-4608205.html,Không chỉ là thành phố trẻ năng động; TP HCM còn là nơi lưu giữ nhiều giá trị văn hóa; lịch sử. Có nhiều di tích; bảo tàng trong thành phố được khách trong và ngoài nước biết đến.
Hồ Chí Minh,https://vnexpress.net/cam-nang-du-lich-tp-hcm-4608205.html,Dinh Độc Lập Dinh Độc Lập hay Dinh Thống Nhất là một trong những địa điểm tham quan không thể bỏ qua khi ghé thăm TP HCM. Tọa lạc tại trung tâm quận 1; Dinh Độc Lập vừa cổ kính; vừa hiện đại; từ lâu đã trở thành một trong những biểu tượng của thành phố.
Hồ Chí Minh,https://vnexpress.net/cam-nang-du-lich-tp-hcm-4608205.html,Vào các ngày cuối tuần hoặc dịp lễ lớn như 30/4; Dinh Độc Lập thường kín khách tham quan.
Hồ Chí Minh,https://vnexpress.net/cam-nang-du-lich-tp-hcm-4608205.html,Vé tham quan Tòa nhà chính và Nhà trưng bày  có giá từ 15.000 đồng đến 65.000 đồng. Nếu chỉ tham quan tòa nhà chính; giá vé là 10.000 đến 40.000 đồng.
Hồ Chí Minh,https://vnexpress.net/cam-nang-du-lich-tp-hcm-4608205.html,Bảo tàng chứng tích chiến tranh Bảo tàng chứng tích chiến tranh đứng thứ 61 và là đại diện duy nhất của Việt Nam trong danh sách 99 điểm đến hút khách nhất thế giới. Bảo tàng nằm trên đường Võ Văn Tần; quận 3; thành lập năm 1975; chuyên nghiên cứu; sưu tầm; bảo quản và trưng bày về chứng tích tội ác; hậu quả của các cuộc chiến tranh xâm lược Việt Nam.
Hồ Chí Minh,https://vnexpress.net/cam-nang-du-lich-tp-hcm-4608205.html,Bảo tàng lưu giữ hơn 20.000 tài liệu; hiện vật và phim ảnh.
Hồ Chí Minh,https://vnexpress.net/cam-nang-du-lich-tp-hcm-4608205.html,Các chủ đề gồm có Vũ khí trưng ngoài trời; Chế độ lao tù; Chất độc da cam; Những sự thật lịch sử; Tội ác chiến tranh.
Hồ Chí Minh,https://vnexpress.net/cam-nang-du-lich-tp-hcm-4608205.html,Vé tham quan bảo tàng: 40.000 đồng mỗi người; trẻ em dưới 6 tuổi được miễn phí.
Hồ Chí Minh,https://vnexpress.net/cam-nang-du-lich-tp-hcm-4608205.html,Giờ mở cửa thứ hai đến thứ sáu từ 7h30 đến 11h30. Thứ 7 và chủ nhật mở từ 7h30 đến 16h30.
Hồ Chí Minh,https://vnexpress.net/cam-nang-du-lich-tp-hcm-4608205.html,Bảo tàng Biệt động Sài Gòn Bảo tàng biệt động Sài Gòn nằm ở tầng hai của một căn nhà xây dựng năm 1963 trên đường Trần Quang Khải; quận 1. Ngôi nhà ban đầu là cơ sở hoạt động bí mật của lực lượng biệt động Sài Gòn dưới sự quản lý của ông Trần Văn Lai (tức Năm Lai). Bảo tàng hoạt động từ ngày 24/12/2019; diện tích hơn 100 m2; trưng bày hơn 100 hiện vật của những người lính biệt động.
Hồ Chí Minh,https://vnexpress.net/cam-nang-du-lich-tp-hcm-4608205.html,Các đồ vật trong nhà vẫn còn nguyên và được bài trí gần giống trước kia.
Hồ Chí Minh,https://vnexpress.net/cam-nang-du-lich-tp-hcm-4608205.html,Khách tham quan được xem những bộ phim ngắn về lực lượng biệt động Sài Gòn.
Hồ Chí Minh,https://vnexpress.net/cam-nang-du-lich-tp-hcm-4608205.html,Giờ tham quan: từ 7h đến 22h các ngày trong tuần; miễn vé vào cửa.
Hồ Chí Minh,https://vnexpress.net/cam-nang-du-lich-tp-hcm-4608205.html,Bảo tàng lịch sử TP HCM Bảo tàng nằm ở số 2 đường Nguyễn Bỉnh Khiêm; quận 1; được xây dựng theo thiết kế đối xứng của kiến trúc sư Auguste Delaval và khánh thành năm 1929.
Hồ Chí Minh,https://vnexpress.net/cam-nang-du-lich-tp-hcm-4608205.html,Hệ thống hành lang rộng; ánh sáng tự nhiên từ sân và kiểu cửa sổ sát mái tránh khí hậu nóng ẩm.
Hồ Chí Minh,https://vnexpress.net/cam-nang-du-lich-tp-hcm-4608205.html,Tháp bát giác ở giữa phủ sơn vàng; lợp ngói ốp có gắn vật trang trí phong cách Á Đông.
Hồ Chí Minh,https://vnexpress.net/cam-nang-du-lich-tp-hcm-4608205.html,Bảo tàng trưng bày khoảng 36.000 hiện vật phản ánh lịch sử của dân tộc Việt Nam từ thời nguyên thủy đến năm 1945. Ngoài ra; bảo tàng còn trưng bày nền văn hóa cổ tại Việt Nam như Óc Eo; Champa; Khmer.
Hồ Chí Minh,https://vnexpress.net/cam-nang-du-lich-tp-hcm-4608205.html,Thời gian tham quan: từ 8h đến 11h30; chiều từ 13h đến 17h.
Hồ Chí Minh,https://vnexpress.net/cam-nang-du-lich-tp-hcm-4608205.html,Phí tham quan: 30.000 đồng một lượt.
Hồ Chí Minh,https://vnexpress.net/cam-nang-du-lich-tp-hcm-4608205.html,Bảo tàng mỹ thuật TP HCM Bảo tàng nằm tại số 97A Phó Đức Chính; quận 1; trước đây vốn là căn nhà thuộc gia đình ông Hứa Bổn Hòa (dân gian hay gọi là Chú Hỏa); một trong tứ đại gia Sài Gòn cuối thế kỷ 19.
Hồ Chí Minh,https://vnexpress.net/cam-nang-du-lich-tp-hcm-4608205.html,Đây được xem là điểm hấp dẫn du khách yêu hội họa; cũng là nơi hút du khách trẻ thích chụp hình. Bảo tàng là toà nhà được xây dựng theo phong cách kiến trúc Pháp cuối thế kỷ 19 đầu thế kỷ 20; kết hợp hài hòa của kiến trúc phương Đông trong trang trí mái ngói; cột ốp gốm và hoạ tiết bằng gốm trên mái nhà...
Hồ Chí Minh,https://vnexpress.net/cam-nang-du-lich-tp-hcm-4608205.html,Giờ tham quan: từ 8h đến 17h các ngày trong tuần.
Hồ Chí Minh,https://vnexpress.net/cam-nang-du-lich-tp-hcm-4608205.html,Bưu điện thành phố Toạ lạc tại Công trường Paris; quận 1; Bưu điện thành phố được xây dựng từ năm 1886 đến 1891.
Hồ Chí Minh,https://vnexpress.net/cam-nang-du-lich-tp-hcm-4608205.html,Công trình do hai kiến trúc sư người Pháp Alfred Foulhoux và Henri Auguste Vildieu thiết kế.
Hồ Chí Minh,https://vnexpress.net/cam-nang-du-lich-tp-hcm-4608205.html,Trải qua hơn 100 năm tồn tại; đây hiện là bưu điện lớn nhất Việt Nam vẫn được giữ nguyên thiết kế ban đầu. Trần nhà vòm cung; ở giữa đắp nổi chân dung thần Mercury với vòng nguyệt quế bao quanh; là vị thần tượng trưng cho sự liên lạc của loài người. Bưu điện gợi nhớ đến hình ảnh ga tàu Orsay tại Paris; toạ lạc song hành cùng Nhà thờ Đức Bà tạo thành cụm kiến trúc đặc biệt của thành phố.
Hồ Chí Minh,https://vnexpress.net/cam-nang-du-lich-tp-hcm-4608205.html,Thời gian tham quan: 7h đến 19h (thứ 2 đến thứ 6); 7h đến 18h (thứ 7) và 8h đến 18h (chủ nhật).
Hồ Chí Minh,https://vnexpress.net/cam-nang-du-lich-tp-hcm-4608205.html,Nhà hát thành phố Nhà hát toạ lạc tại số 7 Công trường Lam Sơn; quận 1.
Hồ Chí Minh,https://vnexpress.net/cam-nang-du-lich-tp-hcm-4608205.html,Công trình do kiến trúc sư Eugène Feret thiết kế và khánh thành năm 1900; là không gian giải trí sang trọng của thành phố. Mặt tiền nhà hát chịu ảnh hưởng nghệ thuật của nhà hát Petit Palais được xây cùng năm tại Paris. Đặc biệt; nhà hát là công trình duy nhất ở thành phố được lợp bằng dòng ngói Ardoise.
Hồ Chí Minh,https://vnexpress.net/cam-nang-du-lich-tp-hcm-4608205.html,Thời gian tham quan: 9h đến 16h30 (thứ 2 đến thứ 6) và 9h đến 12h (thứ 7 và chủ nhật).
Hồ Chí Minh,https://vnexpress.net/cam-nang-du-lich-tp-hcm-4608205.html,Nhà thờ Đức Bà Nhà thờ Đức Bà nằm giữa trung tâm quận 1; là một trong những biểu tượng của thành phố.
Hồ Chí Minh,https://vnexpress.net/cam-nang-du-lich-tp-hcm-4608205.html,Công trình được khởi công năm 1877; hoàn thành năm 1880 do kiến trúc sư người Pháp J.
Hồ Chí Minh,https://vnexpress.net/cam-nang-du-lich-tp-hcm-4608205.html,Bourad thiết kế; với phong cách Roman kết hợp Gothic.
Hồ Chí Minh,https://vnexpress.net/cam-nang-du-lich-tp-hcm-4608205.html,Nội thất thánh đường được thiết kế thành một lòng chính; hai lòng phụ; hai dãy nhà nguyện. Chiều dài thánh đường là 93 m; chiều ngang rộng nhất 35 m; có thể chứa 1.200 người. Mặt trước thánh đường là một công viên với bốn con đường giao nhau tạo thành hình thánh giá.
Hồ Chí Minh,https://vnexpress.net/cam-nang-du-lich-tp-hcm-4608205.html,Thời gian tham quan: từ 8h đến 11h và từ 14h đến 16h.
Hồ Chí Minh,https://vnexpress.net/cam-nang-du-lich-tp-hcm-4608205.html,Tuy nhiên; từ năm 2017; nhà thờ sửa chữa.
Hồ Chí Minh,https://vnexpress.net/cam-nang-du-lich-tp-hcm-4608205.html,Dự kiến thời gian hoàn thành năm 2027.
Hồ Chí Minh,https://vnexpress.net/cam-nang-du-lich-tp-hcm-4608205.html,Cần Giờ Cần Giờ nằm cách trung tâm thành phố khoảng 50 km; có đa dạng địa hình gồm rừng; núi và biển; diện tích xấp xỉ Singapore; nhiều hoạt động du lịch sinh thái có thể trải nghiệm trong ngày. Cần Giờ là huyện duy nhất ở TP HCM giáp biển và cũng là địa phương có rừng ngập mặn đầu tiên ở Việt Nam được công nhận khu Dự trữ sinh quyển thế giới. Tại đây; du khách sẽ đến khu Lâm viên Cần Giờ; đi ca nô trong rừng đước thăm căn cứ cách mạng Rừng Sác; các di tích và tìm hiểu về cuộc sống; các trận đánh và chiến tích của những chiến sĩ đặc công trong thời kỳ chiến tranh; chiêm ngưỡng đàn khỉ tự nhiên trên 1.000 con; đi ca nô trên sông đến khu du lịch sinh thái Vàm Sát; chèo ghe tham quan khu bảo tồn dơi nghệ; câu cua; tham quan khu bảo tồn chim; cá sấu hoa cà; trải nghiệm cảm giác mạo hiểm khi đi trên thuyền câu cá sấu; chinh phục tháp Tang Bồng cao 26 m ngắm toàn cảnh rừng ngập mặn. Tại Cần Giờ có chợ Hàng Dương; được xem như  với nhiều loại tôm; cua; ốc; mực tươi sống; giá cả phải chăng. Bạn có thể lựa chọn các loại sò; ốc; cua; ghẹ; tôm; mực tươi và nhờ người bán trực tiếp chế biến tại chỗ với chi phí vài chục ngàn đồng cho một món.
Hồ Chí Minh,https://vnexpress.net/cam-nang-du-lich-tp-hcm-4608205.html,Di chuyển: Từ trung tâm thành phố; theo hướng cầu Tân Thuận; tới bến phà Bình Khánh và mua vé qua phà. Du khách có thể đi bằng xe máy; ôtô; xe buýt.
Hồ Chí Minh,https://vnexpress.net/cam-nang-du-lich-tp-hcm-4608205.html,Địa đạo Củ Chi Cách trung tâm TP HCM khoảng 70 km; địa đạo Củ Chi (huyện Củ Chi) với hệ thống đường hầm dài khoảng 250 km; là căn cứ địa vững chắc của Khu ủy Quân khu; Bộ tư lệnh Sài Gòn - Gia Định; góp phần không nhỏ vào công cuộc thống nhất đất nước. Ngày nay di tích địa đạo được bảo tồn ở hai khu vực Bến Dược (xã Phú Mỹ Hưng) và Bến Đình (xã Nhuận Đức); thu hút du khách khi đến TP HCM.
Hồ Chí Minh,https://vnexpress.net/cam-nang-du-lich-tp-hcm-4608205.html,Một số đường hầm được cải tạo; mở nắp rộng hơn cho du khách tham quan.
