province,url,Content
Hồ Chí Minh,https://www.agoda.com/vi-vn/travel-guides/vietnam/ho-chi-minh-city/essential-ho-chi-minh-city-guide-10-must-see-spots-for-first-time-visitors/,Đó là một nơi tuyệt vời để thư giãn và gặp gỡ những người bạn đồng hành. Trải nghiệm sự yên tĩnh của Việt Nam với chuyến đi trong ngày đến Đồng bằng sông Cửu Long. Chuyến tham quan này mang đến cơ hội ngắm nhìn chợ nổi; những ngôi làng truyền thống và cảnh quan tuyệt đẹp. Đó là một sự thay đổi mới mẻ từ sự hối hả và nhộn nhịp của thành phố. Thành phố Hồ Chí Minh là một điểm đến năng động mang lại nhiều điều thú vị cho mọi người. Từ các di tích lịch sử và trải nghiệm văn hóa đến cuộc sống về đêm sôi động và những món ăn ngon; thành phố này đảm bảo mang đến một hành trình khó quên cho những du khách lần đầu ghé thăm. Lên kế hoạch cho chuyến đi của bạn với những địa điểm không thể bỏ qua này và hòa mình vào trái tim của Việt Nam. Chào mừng bạn đến với Thành phố Hồ Chí Minh; một đô thị sôi động pha trộn di sản lịch sử phong phú với nét quyến rũ hiện đại. Cho dù bạn biết đến nơi này bằng cái tên lịch sử; Sài Gòn hay tên hiện tại; thành phố này là điểm dừng chân không thể bỏ qua đối với du khách đến thăm Việt Nam. Trong hướng dẫn này; chúng tôi sẽ đề cập đến các điểm tham quan hàng đầu; thông tin chi tiết về địa phương; các địa điểm ăn uống ngon và mẹo du lịch thiết thực để giúp du khách lần đầu trải nghiệm những điều tuyệt vời nhất ở Thành phố Hồ Chí Minh. Bắt đầu cuộc phiêu lưu ở Thành phố Hồ Chí Minh của bạn tại Chợ Bến Thành; một trong những địa danh lâu đời nhất của thành phố. Tọa lạc tại Quận 1; khu chợ nhộn nhịp này là nơi lý tưởng để mua sắm; nếm thử các món ăn địa phương và trải nghiệm bầu không khí sôi động. Từ đồ thủ công truyền thống đến ẩm thực đường phố; chợ Bến Thành có đủ mọi thứ. Để tìm hiểu sâu hơn về lịch sử Việt Nam; hãy ghé thăm Bảo tàng Chứng tích Chiến tranh. Bảo tàng này mang đến cái nhìn thoáng qua về Chiến tranh Việt Nam thông qua nhiều triển lãm khác nhau; bao gồm ảnh; hiện vật và thiết bị quân sự. Đây là một chuyến tham quan cần thiết để hiểu về quá khứ của đất nước.
Hồ Chí Minh,https://www.agoda.com/vi-vn/travel-guides/vietnam/ho-chi-minh-city/essential-ho-chi-minh-city-guide-10-must-see-spots-for-first-time-visitors/,Cách chợ Bến Thành một quãng đi bộ ngắn là Nhà thờ Đức Bà Sài Gòn.
Hồ Chí Minh,https://www.agoda.com/vi-vn/travel-guides/vietnam/ho-chi-minh-city/essential-ho-chi-minh-city-guide-10-must-see-spots-for-first-time-visitors/,Được thực dân Pháp xây dựng vào cuối thế kỷ 19; nhà thờ tuyệt đẹp này là ví dụ điển hình của kiến trúc tân La Mã. Cửa sổ kính màu tuyệt đẹp và tháp chuông đôi khiến nơi đây trở thành địa điểm không thể bỏ qua. Để có một chuyến đi mạo hiểm trong ngày; hãy đến Địa đạo Củ Chi.
Hồ Chí Minh,https://www.agoda.com/vi-vn/travel-guides/vietnam/ho-chi-minh-city/essential-ho-chi-minh-city-guide-10-must-see-spots-for-first-time-visitors/,Mạng lưới đường hầm phức tạp này đóng một vai trò quan trọng trong Chiến tranh Việt Nam. Du khách có thể khám phá các đường hầm và tìm hiểu về cuộc sống của những người lính đã sử dụng chúng. Các chuyến tham quan có hướng dẫn cung cấp bối cảnh lịch sử và trải nghiệm thực tế.
Hồ Chí Minh,https://www.agoda.com/vi-vn/travel-guides/vietnam/ho-chi-minh-city/essential-ho-chi-minh-city-guide-10-must-see-spots-for-first-time-visitors/,Chùa Ngọc Hoàng nằm ở Quận 1; là viên ngọc ẩn của Thành phố Hồ Chí Minh. Ngôi chùa Đạo giáo này nổi tiếng với kiến trúc trang trí công phu và bầu không khí yên bình. Đó là một nơi hoàn hảo cho những ai muốn trải nghiệm khía cạnh tâm linh của thành phố. Để có cái nhìn toàn cảnh thành phố; hãy ghé thăm Tháp tài chính Bitexco. Skydeck trên tầng 49 mang đến tầm nhìn 360 độ toàn thành phố Hồ Chí Minh. Đây là địa điểm lý tưởng để chụp ảnh và cảm nhận sự rộng lớn của thành phố. Dinh Độc Lập hay còn gọi là Hội trường Thống Nhất là di tích lịch sử nơi Chiến tranh Việt Nam chính thức kết thúc.
Hồ Chí Minh,https://www.agoda.com/vi-vn/travel-guides/vietnam/ho-chi-minh-city/essential-ho-chi-minh-city-guide-10-must-see-spots-for-first-time-visitors/,Kiến trúc và thiết kế nội thất của tòa nhà phản ánh tính thẩm mỹ của những năm 1960; mang đến cái nhìn độc đáo về quá khứ.
Hồ Chí Minh,https://www.agoda.com/vi-vn/travel-guides/vietnam/ho-chi-minh-city/essential-ho-chi-minh-city-guide-10-must-see-spots-for-first-time-visitors/,Bạn có thể thuê hướng dẫn du lịch để được cung cấp thông tin lịch sử chi tiết và đáng giá.
Hồ Chí Minh,https://www.agoda.com/vi-vn/travel-guides/vietnam/ho-chi-minh-city/essential-ho-chi-minh-city-guide-10-must-see-spots-for-first-time-visitors/,Xem buổi biểu diễn tại Nhà Hát Lớn Sài Gòn; một tòa nhà thuộc địa Pháp xinh đẹp ở trung tâm Quận 1. Địa điểm này tổ chức nhiều chương trình biểu diễn; từ các buổi biểu diễn truyền thống của Việt Nam đến các vở kịch đương đại.
Hồ Chí Minh,https://www.agoda.com/vi-vn/travel-guides/vietnam/ho-chi-minh-city/essential-ho-chi-minh-city-guide-10-must-see-spots-for-first-time-visitors/,Đó là một trải nghiệm văn hóa tuyệt vời cho du khách. Để có cuộc sống về đêm sôi động; hãy đến Phố Bùi Viện.
Hồ Chí Minh,https://www.agoda.com/vi-vn/travel-guides/vietnam/ho-chi-minh-city/essential-ho-chi-minh-city-guide-10-must-see-spots-for-first-time-visitors/,Khu vực nhộn nhịp này; được gọi là Phố Tây ba lô; có rất nhiều quán bar; nhà hàng và địa điểm biểu diễn nhạc sống.
Hồ Chí Minh,https://www.agoda.com/vi-vn/travel-guides/vietnam/ho-chi-minh-city/essential-ho-chi-minh-city-guide-10-must-see-spots-for-first-time-visitors/,Đó là một nơi tuyệt vời để thư giãn và gặp gỡ những người bạn đồng hành. Trải nghiệm sự yên tĩnh của Việt Nam với chuyến đi trong ngày đến Đồng bằng sông Cửu Long. Chuyến tham quan này mang đến cơ hội ngắm nhìn chợ nổi; những ngôi làng truyền thống và cảnh quan tuyệt đẹp. Đó là một sự thay đổi mới mẻ từ sự hối hả và nhộn nhịp của thành phố. Thành phố Hồ Chí Minh là một điểm đến năng động mang lại nhiều điều thú vị cho mọi người. Từ các di tích lịch sử và trải nghiệm văn hóa đến cuộc sống về đêm sôi động và những món ăn ngon; thành phố này đảm bảo mang đến một hành trình khó quên cho những du khách lần đầu ghé thăm. Lên kế hoạch cho chuyến đi của bạn với những địa điểm không thể bỏ qua này và hòa mình vào trái tim của Việt Nam.
