province,url,Content
Hồ Chí Minh,https://vnexpress.net/cam-nang-du-lich-tp-hcm-4608205.html,Di chuyển: xe buýt số 13 xuất phát từ chợ Bến Thành tới thẳng Củ Chi; taxi khoảng 500.000 đồng một lượt. Nếu đi bằng ôtô riêng hay xe máy; du khách theo quốc lộ 22 sau đó rẽ vào tỉnh lộ 15.
Hồ Chí Minh,https://vnexpress.net/cam-nang-du-lich-tp-hcm-4608205.html,Chợ Bến Thành Hoạt động từ năm 1914 nằm ngay trung tâm thành phố; không chỉ là nơi mua bán sầm uất mà còn là chứng nhân lịch sử chứng kiến bao đổi thay; thăng trầm của thành phố và là điểm giao hòa giữa Sài Gòn xưa và nay. Nơi đây tập trung nhiều mặt hàng; từ quần áo; dày dép; vải vóc; đồ thủ công mỹ nghệ; hàng thổ cẩm; trang sức đến các món ăn đặc sản. Chợ Tân Định Xây dựng vào năm 1926; cổng chính của chợ có thiết kế độc đáo.
Hồ Chí Minh,https://vnexpress.net/cam-nang-du-lich-tp-hcm-4608205.html,Đây cũng là địa điểm kinh doanh của nhiều mặt hàng; trong đó nổi tiếng là vải vóc và ẩm thực. Quầy ẩm thực ở khu chợ này luôn được thực khách đánh giá cao bởi món ăn đa dạng; ngon và hấp dẫn như bún mắm; súp cua; bánh canh cua; trái cây dĩa và đặc biệt là món xôi gà luôn được nhiều người biết đến. Chợ Bình Tây (Chợ Lớn) Chợ nằm ở cửa ngõ phía tây thành phố; trong khu phố Tàu; luôn là một trong các điểm đến được đánh dấu trên bản đồ du lịch của nhiều du khách. Hoạt động từ năm 1930; chợ được xây dựng với kiến trúc đậm phong cách Á Đông. Các góc mái uốn lượn theo kiểu đình chùa; lợp ngói âm dương vừa cổ kính; vừa thông thoáng.
Hồ Chí Minh,https://vnexpress.net/cam-nang-du-lich-tp-hcm-4608205.html,Chợ Bình Tây còn là trung tâm đầu mối với nhiều mặt hàng. TP HCM là nơi hội tụ của ẩm thực nhiều vùng miền và nhiều quốc gia.
Hồ Chí Minh,https://vnexpress.net/cam-nang-du-lich-tp-hcm-4608205.html,Du khách có thể tìm thấy món ăn dọc ba miền; còn có món Hoa đặc trưng; ẩm thực Ấn Độ; Nhật Bản; Hàn Quốc; Thái Lan...
Hồ Chí Minh,https://vnexpress.net/cam-nang-du-lich-tp-hcm-4608205.html,hay đồ chay tại vô số các nhà hàng lớn nhỏ trong thành phố.
Hồ Chí Minh,https://vnexpress.net/cam-nang-du-lich-tp-hcm-4608205.html,Các món ăn đặc trưng du khách nên thử gồm: cơm tấm; hủ tíu; bánh mì; cá lóc nướng trui; bánh xèo; cơm cháy kho quẹt.
Hồ Chí Minh,https://vnexpress.net/cam-nang-du-lich-tp-hcm-4608205.html,Các phố ẩm thực dưới đây là gợi ý cho những người lần đầu đến TP HCM. Đường Phan Xích Long Đường Phan Xích Long; quận Phú Nhuận là nơi tập trung của nhiều nhà hàng; quán ăn; thương hiệu ẩm thực có tiếng. Tại đây; du khách có thể tìm được lẩu; đồ nướng; nhà hàng kiểu Âu; nhà hàng Nhật; Thái; Hàn; quán ăn kiểu Việt. 13 con đường mang tên các loại hoa bao quanh đường lớn Phan Xích Long như Hoa Phượng; Hoa Lan; Hoa Huệ; Hoa Mai cũng tập trung nhiều quán cà phê; quán bar tầng thượng; mở cửa đến nửa đêm. Phố ốc Vĩnh Khánh Các món ốc là đặc sản của TP HCM. Bất kỳ ở đâu trong thành phố đều có thể bắt gặp các hàng ốc; trong đó dọc con phố Vĩnh Khánh; quận 4; tập trung nhiều hàng ốc; hải sản nổi tiếng nhất thành phố.
Hồ Chí Minh,https://vnexpress.net/cam-nang-du-lich-tp-hcm-4608205.html,Các cửa tiệm thường mở đến nửa đêm; tấp nập khách.
Hồ Chí Minh,https://vnexpress.net/cam-nang-du-lich-tp-hcm-4608205.html,Các món ốc có giá từ 80.000 đến 150.000 đồng một phần tùy loại ốc. Khác với ốc Hà Nội thường có kiểu chế biến đặc trưng là hấp sả; chấm nước mắm ớt; ốc ở TP HCM chế biến đa dạng từ sốt trứng muối; đến xào me; nướng muối ớt; xào sa tế. Phố ẩm thực Hồ Thị Kỷ Phố ẩm thực trên đường Hồ Thị Kỷ; quận 10 là một trong những điểm đến hút cả du khách lẫn dân địa phương. Mở cửa từ 15h mỗi ngày; hơn 100 hàng quán bán đủ món Âu-Á và nhiều vùng miền khác ở Việt Nam. Khu phố thu hút thực khách nhờ những món xiên nướng; các loại hải sản chế biến như tôm hùm nướng phô mai; răng mực nướng muối ớt. Các món có mức giá dao động từ 7.000 đến 100.000 đồng.
Hồ Chí Minh,https://vnexpress.net/cam-nang-du-lich-tp-hcm-4608205.html,Phố ẩm thực Nguyễn Thượng Hiền Phố ẩm thực Nguyễn Thượng Hiền (từ đường Điện Biên Phủ đến Nguyễn Đình Chiểu; quận 3) hoạt động từ 19h đến 23h mỗi ngày. Trên tuyến có hơn 90 điểm kinh doanh ăn uống cùng hơn 50 cửa hàng buôn bán quần áo; giày dép; làm đẹp. Con phố nổi tiếng với những món ăn như bánh tráng trộn; tré trộn; nước ép bưởi. Một số cửa tiệm cũng phục vụ món ăn kiểu Campuchia.
Hồ Chí Minh,https://vnexpress.net/cam-nang-du-lich-tp-hcm-4608205.html,Phố sủi cảo Hà Tôn Quyền Đường Hà Tôn Quyền; quận 11; là địa chỉ bán sủi cảo gốc Hoa có tiếng; với các cửa hàng dọc hai bên phố.
Hồ Chí Minh,https://vnexpress.net/cam-nang-du-lich-tp-hcm-4608205.html,Cả khu phố lúc nào cũng tấp nập người ra vào; nhất là chiều và tối.
Hồ Chí Minh,https://vnexpress.net/cam-nang-du-lich-tp-hcm-4608205.html,Các món ở đây phong phú như chiên; khô (sốt dầu hào); mì sủi cảo; tôm mực; thập cẩm; cá viên; mì kéo với giá trung bình từ 50.000 đồng một phần. Khách thường chạy xe dọc phố; sẽ có người từ hàng quán ra chào mời; hướng dẫn chỗ để xe miễn phí rồi vào nhà gọi món. Chủ động bảo quản tư trang cá nhân khi đến nơi đông người và khi đi lại trên đường.
Hồ Chí Minh,https://vnexpress.net/cam-nang-du-lich-tp-hcm-4608205.html,Du khách nên tránh ra đường vào giờ cao điểm; buổi sáng 8h-9h30; buổi chiều 17h30-19h bởi dễ bị tắc đường. Nên kiểm tra đường đi theo bản đồ để tránh các đường một chiều và làn ôtô nếu di chuyển bằng xe máy; đặc biệt ở khu trung tâm. TP HCM có nhiều hẻm nhỏ thông nhau; du khách không nên đi vào các hẻm nếu không thạo đường.
Hồ Chí Minh,https://dulich24.com.vn/du-lich-tphcm/tp-ho-chi-minh-id-10,Du lịch đến với Sài Gòn – TP.HCM hơn 300 năm tuổi; bạn có thể gặp những tòa nhà cao tầng nằm san sát; những khu vui chơi giải trí; trung tâm mua sắm sầm uất; nhưng cũng không thiếu những biệt thự cổ kính; những ngôi chợ truyền thống tồn tại đã hàng trăm năm. Sài Gòn rộng lớn và không thiếu những “đặc sản” du lịch như Du ngoạn ven sông Sài Gòn bằng tàu; thăm phố Tây Phạm Ngũ Lão; mua sắm ở chợ Bến Thành hay về với biển Cần Giờ…. Thành Phố Hồ Chí Minh Phương tiện đi lại chủ yếu cho du khách du lịch Sài Gòn chủ yếu là xe máy; ô tô; xe đạp; xe buýt; xe xích lô. Phương tiện di chuyển công cộng rẻ nhất là xe buýt chỉ 5.000VND/tuyến; xe ôm và taxi. Hiện nay; mật độ giao thông ở TP.HCM khá đông đúc; nhiều đoạn đường trong thành phố xảy ra tình trạng kẹt xe vào giờ tan tầm: từ 7h00 – 8h00 sáng và 17h00 – 18h00 chiều. Xe xích lô là một phương tiện được nhiều du khách yêu thích TPHCM có hai mùa rõ rệt là mùa nắng và mùa mưa; mùa mưa bắt đầu từ tháng 6 và kết thúc vào tháng 11. Nhưng nhìn chung bạn có thể đến TPHCM bất cứ tháng nào trong năm và đừng đi du lịch tại TPHCM vào những ngày tết nguyên đán. Khi tết nguyên đán mọi người thường về quê hương ăn tế với gia đình. Đường hoa Nguyễn Huệ được tổ chức vào dịp Tết hàng năm Vào các mùa lễ hội hoạt động mua sắm và vui chơi tại TPHCM diễn ra vô cùng sôi nỗi trên khắp các ngả đường. Vào mùa Noel các con đường tràn ngập ánh đèn; xe cộ tấp nập và các hoạt động vui chơi giải trí diển ra gần tàn đêm; bạn có thể đến TPHCM vào những ngày này để tận hưởng cái không khí se se lạnh nhưng ấm áp tại TPHCM. Đừng lo ngại sự ồn ào của TPHCM bạn đến đây bất cứ ngày nào trong năm củng có các khu du lịch sinh thái; khu nghĩ dưỡng… cho bạn thư giãn.
Hồ Chí Minh,https://dulich24.com.vn/du-lich-tphcm/tp-ho-chi-minh-id-10,Nhà Hát Lớn Thành Phố Hồ Chí Minh; hay thường được biết đến với tên gọi Nhà hát Thành Phố là một nhà hát nằm trên đường Công trường Lam Sơn; Quận 1; Thành phố Hồ Chí Minh. Nằm ở một vị trí thuận lợi tại trung tâm thành phố; nhà hát được xem là nhà hát trung tâm; đa năng chuyên tổ chức biểu diễn sân khấu nghệ thuật đồng thời cũng được sử dụng để tổ chức một số sự kiện lớn. Đây cũng là nhà hát thuộc loại lâu đời theo kiến trúc Tây Âu và được xem như một địa điểm du lịch của thành phố này. Nhà Hát Lớn Thành Phố Hồ Chí Minh Trải qua hơn 100 năm và qua 3 thế kỷ; Nhà thờ Đức Bà Sài Gòn; tên chính thức là Vương cung Thánh đường Chính tòa Đức Mẹ Vô nhiễm Nguyên tội (Immaculate Conception Cathedral Basilica) vẫn đẹp lộng lẫy; tráng lệ và uy nghiêm; được coi là một tuyệt tác kiến trúc đô thị Sài Gòn. Đây là một công trình nhà thờ Công giáo nói riêng và tôn giáo nói chung rất đặc sắc; có quy mô thuộc loại lớn nhất ở Việt Nam. Cùng với một số công trình lân cận ở quận 1 như Nhà Bưu Điện trung tâm; Nhà hát thành phố; Bệnh viện Nhi Đồng 2…; Nhà thờ Đức Bà là một công trình tiêu biểu tạo nên bộ mặt kiến trúc đô thị Sài Gòn – Thành phố Hồ Chí Minh Nhà Thờ Đức Bà Nằm ở khu vực trung tâm thành phố; từ lâu chợ Bến Thành đã trở thành biểu tượng của Sài Gòn. Không chỉ thuần túy là nơi buôn bán; gần một trăm năm qua ngôi chợ này đã trở thành một chứng nhân lịch sử chứng kiến bao đổi thay thăng trầm của thành phố; là bộ mặt kinh tế nói lên sự phát triển của một thành phố thương mại lớn nhất nước và là điểm giao hòa giữa Sài Gòn xưa và nay Nằm ở khu vực trung tâm thành phố; từ lâu chợ Bến Thành đã trở thành biểu tượng của Sài Gòn Kể từ thời khắc lịch sử Chủ tịch Hồ Chí Minh rời Bến Nhà Rồng; trên sông Sài Gòn; Thành phố Hồ Chí Minh; ra đi tìm đường cứu nước đã hơn 100 năm. Ngày nay; bến Nhà Rồng đã trở thành nơi mà các thế hệ cháu con đất Việt tìm về để hiểu và trân trọng hơn những giá trị của lòng yêu nước và tinh thần đấu tranh Cách mạng kiên cường của Chủ tịch Hồ Chí Minh.
Hồ Chí Minh,https://dulich24.com.vn/du-lich-tphcm/tp-ho-chi-minh-id-10,Bến Cảng Nhà Rồng Khu du lịch văn hóa Suối Tiên tọa lạc tại cửa ngõ Ðông Bắc Sài Gòn; trên tuyến Xa lộ Hà Nội; thuộc địa bàn phường Tân Phú; Quận 9; Tp.
Hồ Chí Minh,https://dulich24.com.vn/du-lich-tphcm/tp-ho-chi-minh-id-10,Hồ Chí Minh; cách trung tâm Thành phố khoảng 19km.
Hồ Chí Minh,https://dulich24.com.vn/du-lich-tphcm/tp-ho-chi-minh-id-10,Là một trong những địa điểm vui chơi giải trí cuối tuần nổi tiếng của người dân TPHCM và mọi du khách trong và ngoài nước. Đến đây; du khách sẽ được tận hưởng phong cảnh tự nhiên hữu tình: có suối chảy; có rừng cây; hồ cá... được bố trí xem kẽ; kết hợp hài hòa trong một tổng thể không gian xanh mát; rộng lớn Vị trí: Khu du lịch văn hóa Suối Tiên tọa lạc tại cửa ngõ Ðông Bắc Sài Gòn; trên tuyến Xa lộ Hà Nội; thuộc địa bàn phường Tân Phú; Quận 9; Tp.
Hồ Chí Minh,https://dulich24.com.vn/du-lich-tphcm/tp-ho-chi-minh-id-10,Hồ Chí Minh;cách trung tâm Thành phố khoảng 19km.
Hồ Chí Minh,https://dulich24.com.vn/du-lich-tphcm/tp-ho-chi-minh-id-10,Khu du lịch văn hóa Suối Tiên Công viên Văn hóa Đầm Sen là một trong những công viên lớn và hiện đại nhất cả nước. Với diện tích gần 50 ha; trong đó có hơn 60% diện tích là cây xanh - hoa cảnh và 20% diện tích mặt hồ.
Hồ Chí Minh,https://dulich24.com.vn/du-lich-tphcm/tp-ho-chi-minh-id-10,Công viên Văn hóa Đầm Sen thật sự trở thành một ốc đảo xanh giữa lòng Thành Phố Hồ Chí Minh. Bên cạnh vẻ đẹp của thiên nhiên; Công Viên Văn Hóa Đầm Sen còn là nơi vui chơi giải trí rất hấp dẫn cho các em thanh - thiếu nhi Công viên Văn hóa Đầm Sen TP.HCM là nơi tập trung dân cư thuộc tất cả các vùng miền trên cả nước. Vì thế ẩm thực ở đây vô cùng phong phú với những món ăn đặc trưng Nam Bộ hay món ăn du nhập từ các miền đất trên cả nước. Du lịch Sài Gòn; bạn hãy nếm thử những món ăn ngon miệng ấy nhé! Lẩu mắm ngon nhất thì phải về miền Tây (Cần Thơ; Vĩnh Long; Long An); nhưng nếu không có thời gian thì bạn có thể thưởng thức lẩu mắm ngay tại Sài Gòn. Nồi lẩu mắm quan trọng nhất là nước dùng; phải chế biến từ loại mắm ngon; nêm nếm khéo léo cho vừa ăn. Lẩu mắm ở Sài Gòn thường có rau muống; kèo nèo; bông súng; đậu bắp; bạc hà; bắp chuối; rau nhút. Một vài địa chỉ nổi tiếng: + Lẩu mắm Nam Bộ 94AB Cao Thắng; P.4; Q.3; giá: 160.000 – 240.000VND; + Lẩu mắm Ăn là khen: 11 Hồ Biểu Chánh; P.12; Q. Phú Nhuận; giá: + Lẩu mắm: 210.000 – 300.000VND.
Hồ Chí Minh,https://dulich24.com.vn/du-lich-tphcm/tp-ho-chi-minh-id-10,Giống như lẩu mắm; nước dùng là thành phần quan trọng nhất của món bún mắm. Tô bún mắm ngon không quá ngọt; quá mặn hay cay nhưng cũng không hề nhạt nhẽo; nhất là không thể thiếu vị thơm nức của mắm. Ăn bún mắm ngoài lát cá; thịt heo quay; tôm; mực; không thể thiếu đĩa rau sống với rau đắng; bắp chuối; kèo nèo; cọng bông súng; húng thơm. Một số quán ăn ghi điểm thêm nhờ tô nước mắm me chua chua ngọt ngọt rất hấp dẫn.
Hồ Chí Minh,https://dulich24.com.vn/du-lich-tphcm/tp-ho-chi-minh-id-10,Một vài địa chỉ nổi tiếng: +Bún mắm Huỳnh Lâm (gia truyền Bạc Liêu); 37A Gò Dầu; Q. Tân Phú: 28.000VND/tô; +Quán bún mắm 444 – 369 Lê Quang Định; P.5; Q.Bình Thạnh; mở cửa từ 9h đến 21h hàng ngày; trừ ngày rằm và mùng 1; giá 35.000VND/tô; +bún mắm 528 Phan Văn Trị; Q.Gò Vấp; giá 30.000VND/tô. Lẩu mắm ở Sài Gòn thường có rau muống; kèo nèo; bông súng; đậu bắp; bạc hà; bắp chuối; rau nhút. Bún bò Huế là một trong những đặc sản của xứ Huế; từ lâu cũng trở nên rất phổ biến tại Sài Gòn. Trong nước dùng của bún; người Huế thường nêm vào một ít mắm ruốc; góp phần làm nên hương vị rất riêng. Bạn có thể dễ dàng thưởng thức món ăn bình dân này tại nhiều con phố ở Sài Gòn; giá từ 20.000VND/tô. Một vài địa chỉ nổi tiếng: Bún bò Thành Nội Huế; 47A Trần Cao Vân; Q.3 (gần vòng xoay hồ Con Rùa); Bún bò Huế Đông Ba; 110A Nguyễn Du; P. Bến Thành; Q.1 Lẩu cá kèo là món ăn mang hương vị miền Nam đặc trưng. Món lẩu từ cá kèo thường được nấu kèm với lá giang tạo nên vị chua chua; chát chát đặc trưng. Rau dùng với lẩu cá kèo gồm rau muống; rau nhút và rau đắng; giá; hoa chuối… Mang hương thơm hấp dẫn của rau và gia vị đặc trưng; nồi lẩu cá kèo bốc lên sẽ thơm lừng; khó quên.
Hồ Chí Minh,https://dulich24.com.vn/du-lich-tphcm/tp-ho-chi-minh-id-10,Một vài địa chỉ nổi tiếng: + Số 4 Nguyễn Thị Diệu; P.6; Q.3; + Các quán lẩu cá kèo trên đường Sư Thiện Chiếu. Một nồi lẩu cá kèo thơm ngon Những món ăn này tuy không phải nguồn gốc bản địa song giờ đây cũng trở thành nét đặc trưng của Sài Gòn. Với người dân Sài Gòn; món này dễ ăn và khá được ưa chuộng. Tuy nhiên với dân Bắc; món này có vị hơi ngọt; có thể không quen khi thưởng thức lần đầu. Các quán hủ tiếu rất sẵn trên bất kỳ còn đường; ngõ hẻm nào của Sài Gòn với giá từ 20.000VND/tô. Một vài địa chỉ nổi tiếng: + Hủ tiếu mì trên đường Mạc Thị Bưởi (Q.1); hủ tiếu cá gà trên đường Tôn Thất Đạm (Q.1). + Hủ tiếu mì vàng trên đường Hải Thượng Lãn Ông (Q.5). + Hủ tiếu 46/102 Võ Văn Tần; Q.3; mì Vịt tiềm trên đường Phạm Văn Hai (Q.Tân Bình); mì chú Tắc: 22 Bà Huyện Thanh Quan; Q.3.
Hồ Chí Minh,https://dulich24.com.vn/du-lich-tphcm/tp-ho-chi-minh-id-10,Đây là món ăn của người Tây Ninh; ngoài bánh tráng phơi sương còn có bánh canh; bánh tráng được ăn với thịt heo luộc; thịt bò luộc; cùng với rất nhiều loại rau và mắm nêm đặc trưng của người miền Tây. Một vài địa chỉ nổi tiếng: + Bạn có thể ăn bánh tráng Trảng Bàng ở hệ thống cửa hàng của Hoàng Ty. + bánh tráng Trảng Bàng 411 – 413 Nguyễn Tri Phương; Q.10. Món bành tráng Trảng Bàng Miếng thịt bò mềm ngọt được quấn với các loại rau tươi rói của Nam Bộ và bánh tráng; ăn với nước chấm chua ngọt pha rất khéo đã làm nên đặc sản bò tơ Củ Chi nổi tiếng. Hiện nay nhiều nhà hàng ở Sài Gòn đã phục vụ món nay nhưng thực khách vẫn chưa tìm được nơi nào có thể sánh ngang với bò tơ chính gốc tại Củ Chi. Một vài địa chỉ nổi tiếng: + Quán bò tơ Xuân Đào – Đi thẳng trên đường Quốc lộ 22; Qua ngã tư Trung chánh và đến cầu vượt Củ Chi; nhìn phía tay phải sẽ thấy quán bò tơ Xuân Đào; huyện Củ Chi; + Bò tơ Hồng Đào cũng ở Quốc lộ 22 nhưng bên tay trái. Món bò tơ Củ Chi Bánh xèo có vỏ bánh vàng ruộm ở bên ngoài; bên trong có nhân tôm; thịt; giá đỗ; đúc thành hình tròn hoặc gấp lại thành hình bán nguyệt. Bánh xèo miền Nam có trứng; khi ăn chấm nước mắm chua ngọt và rất nhiều loại rau và lá cây tại miệt vườn. Tại một số nhà hàng người ta cho thêm các loại nấm làm nhân bánh xèo ăn rất ngon miệng và bớt ngán.
Hồ Chí Minh,https://dulich24.com.vn/du-lich-tphcm/tp-ho-chi-minh-id-10,Một vài địa chỉ nổi tiếng: + 46A Đinh công Tráng; Q.1; Mười Xiềm; 190 Nam Kỳ Khởi Nghĩa; P.6; Q.3; + Ăn Là Ghiền; 74 Sương Nguyệt Ánh; P.Bến Thành; Q.1.
Hồ Chí Minh,https://dulich24.com.vn/du-lich-tphcm/tp-ho-chi-minh-id-10,Món Bánh xèo Nam Bộ Nguyên liệu để có một cuốn gỏi cuốn chất lượng là phải đầy đủ: rau; bún; tôm; thịt ba chỉ và tất nhiên không thể thiếu bánh tráng dẻo để cuốn bên ngoài. Tuy nhiên; điều chính yếu để có thể cảm nhận một cuốn gỏi ngon là thành phần nước chấm của nó. Người Nam hay dùng gỏi cuốn chấm với tương đen vì nó có vị ngòn ngọt; cộng thêm đậu phộng và đồ chua nữa.
Hồ Chí Minh,https://dulich24.com.vn/du-lich-tphcm/tp-ho-chi-minh-id-10,Gỏi cuốn bình dân; thân thuộc đến thế nhưng lại lá 1 trong 50 món ăn ngon nhất thế giới do CNN bình chọn.
Hồ Chí Minh,https://dulich24.com.vn/du-lich-tphcm/tp-ho-chi-minh-id-10,Gỏi cuốn được bày bán rộng rãi ở khắp các hàng rong; quán cóc; chợ và cả siêu thị giá chỉ 3.000VND/cuốn. Một số địa chỉ cho bạn: + Vỉa hè công viên Lê Văn Tám (đường Hai Bà Trưng); + siêu thị BigC + siêu thị Coopmart Món gỏi cuốn Quán ốc ở Sài Gòn là từ gọi chung; bởi ở đó còn có nhiều loại hải sản khác. Rủ nhau đi ăn ốc cũng là để thưởng thức một thế giới nhuyễn thể thân mềm và giáp xác phong phú; từ nghêu; sò; ốc; hến; đến cua; ghẹ; mực; tôm Có đủ cách chế biến ở Sài Gòn để món ốc luôn hấp dẫn; từ hấp; luộc; xào; chiên; rang đến nướng mọi; đút lò với đủ thứ gia vị như tỏi; hành; tiêu; ớt; rau răm; sả; gừng; húng quế; phô mai; bơ.
Hồ Chí Minh,https://dulich24.com.vn/du-lich-tphcm/tp-ho-chi-minh-id-10,Một vài địa chỉ nổi tiếng: + Ốc Đào 2- 132 Nguyễn Thái Học; Q.1; + Ốc Quang Anh; 189 Tô Hiến Thành; P13; Q.10; + Ốc số 9; 23 Nguyễn Văn Giai; P. Ða Kao; Q.1; + Ốc cô Hồng; hẻm 177 đường 3/2; Q.10; + Ốc Xinh; 002 Lô B5 chung cư P.3; đường nội bộ 12B; Khánh Hội; Q.4; + Quán Ốc Việt: 237/50 Trần Văn Đang; P.11; Q.3.
Hồ Chí Minh,https://dulich24.com.vn/du-lich-tphcm/tp-ho-chi-minh-id-10,Các món ốc thơm ngon Chè miền Nam rất phong phú; từ các loại chè nóng như chè bà ba; chè chuối thưng; chè khoai môn đến chè lạnh như chè đậu đen; chè thập cẩm; chè Huế; chè của người Hoa đều rất hấp dẫn với vị nước cốt dừa béo ngậy và vị ngọt; bùi của nguyên liệu. Một vài địa chỉ nổi tiếng: + Chè Kỳ Đồng; 153/7 Kỳ Đồng; P.9; Q.3; Hà Kí; 140 Châu Văn Liêm; Q.5; + Chè Nam Bộ 16/1A Đinh Tiên Hoàng; P.Đa Kao; Q.1; + Chè mâm 12 món – số 032 lô H; chung cư Ngô Gia Tự; đường Sư Vạn Hạnh; Q.10.
Hồ Chí Minh,https://dulich24.com.vn/du-lich-tphcm/tp-ho-chi-minh-id-10,Chuyến thăm thú thành phố Sài Gòn sẽ càng thêm thú vị với chuyến vi vu buổi tối của bạn. Ở Sài Gòn có rất nhiều điểm vui chơi giải trí hấp dẫn; hoạt động nhộn nhịp mỗi khi thành phố lên đèn. Quán bar là nơi giải trí thú vị ở Sài Gòn.
Hồ Chí Minh,https://dulich24.com.vn/du-lich-tphcm/tp-ho-chi-minh-id-10,Một số bar nổi tiếng gồm: + Sahara Bar; 227 Phạm Ngũ Lão; Q.1 + Go2 Bar 187 Đề Thám; Q.1 + Vasco Bar; 16D Cao Bá Quát + Saigon Saigon Bar; 19 Lam Sơn; 224 Đề Thám; phường Phạm Ngũ Lão… Xem phim tại MegaStar Hùng Vương 126 Hùng Vương; Q.5; Galaxy Cinema 116 Nguyễn Du; Q.1; Diamond Cinema; tầng 13 Diamond Plaza; 34 Lê Duẩn; Q.1; Cinebox 212; 212 Lý Chính Thắng; Q.3. Các địa chỉ thường xuyên có xuất diễn kịch: Kịch Hồng Vân; 70-72 Nguyễn Văn Trỗi; Q.Phú Nhuận; Sân khấu Idecaf; 7 Trần Cao Vân; Phường Đa Kao; Quận 1; sân khấu Hoàng Thái Thanh; 36 Lê Quý Đôn; Phường 7; Quận 1; sân khấu 5B; 5B Võ Văn Tần; Q.3.
Hồ Chí Minh,https://dulich24.com.vn/du-lich-tphcm/tp-ho-chi-minh-id-10,Diamond Plaza Ở Sài Gòn có rất nhiều khu chợ và các trung tâm mua sắm sầm uất. Các tín đồ shopping chắc chắn sẽ “bội thu” ở thành phố này vì hàng hóa đa dạng; đủ loại từ bình dân đến xa xỉ nhất. Phục vụ đối tượng chính là khách du lịch; chợ Bến Thành bày bán rất nhiều mặt hàng thủ công mỹ nghệ; quần áo; vải vóc; giày dép Ngoài khu bán hàng của Saigon Co.op có niêm yết giá bán; bạn nhớ xem xét giá thật kỹ trước khi mua hàng nhé. Đây là địa chỉ mua sắm ưa thích của rất nhiều nữ công dân Sài Gòn. Với thế mạnh về quần áo; giày dép; túi xách; hàng bình dân và trung cấp; Sài Gòn Square thường xuyên tấp nập khách hàng; đặc biệt vào cuối tuần. Mua sắm ở đây cũng nên trả giá cẩn thận; có chỗ nói thách rất cao (gấp đôi).
Hồ Chí Minh,https://dulich24.com.vn/du-lich-tphcm/tp-ho-chi-minh-id-10,Saigon Square 1 (Ngã Tư Nam Kì Khởi Nghĩa – Lê Lợi ( gần nhà hàng Hoàng Thành ); Quận 1; Saigon Square 2 – 7-9 Tôn Đức Thắng; Địa chỉ: Phường Bến Nghé Quận 1.
Hồ Chí Minh,https://dulich24.com.vn/du-lich-tphcm/tp-ho-chi-minh-id-10,Saigon Square Là chợ bán sỉ; hàng hóa ở chợ này rất rẻ nếu mua với số lượng lớn.
