province,url,Content
Hồ Chí Minh,https://dulich24.com.vn/du-lich-tphcm/tp-ho-chi-minh-id-10,Tuy nhiên; mua lẻ thì giá không rẻ được bao nhiêu mà người bán ít nhiệt tình. Nhiều cửa hàng ở chợ Bình Tây niêm yết giá hoặc nói thách không nhiều.
Hồ Chí Minh,https://dulich24.com.vn/du-lich-tphcm/tp-ho-chi-minh-id-10,Đây là những trung tâm thương mại cao cấp ở TP.HCM.
Hồ Chí Minh,https://dulich24.com.vn/du-lich-tphcm/tp-ho-chi-minh-id-10,Ngoài những gian hàng cao cấp; mua sắm xong; bạn có thể nghỉ chân tại các khu ẩm thực; giải trí ngay trong tòa nhà.
Hồ Chí Minh,https://dulich24.com.vn/du-lich-tphcm/tp-ho-chi-minh-id-10,Địa chỉ: Diamond plaza 34 Lê Duẩn; Q.1; Parkson; 35 Bis – 45; Lê Thánh Tôn; Q.1; Vincom; 45A Lý Tự Trọng; Q.1; Saigon Centre; 65 Lê Lợi; P.Bến Nghé; Q.1.
Hồ Chí Minh,https://www.visithcmc.vn/news/top-20-places-you-need-to-visit-in-ho-chi-minh-city,Văn Hóa & Lịch Sử Với sự kết hợp giữa vẻ đẹp của thiên nhiên; kiến trúc độc đáo; văn hóa nổi bật và sự phong phú trong ẩm thực; TP.HCM là một trong những điểm du lịch hàng đầu tại Việt Nam. Du khách sẽ có thể tận hưởng những trải nghiệm độc đáo và khám phá những điều mới mẻ trong thành phố này.
Hồ Chí Minh,https://www.visithcmc.vn/news/top-20-places-you-need-to-visit-in-ho-chi-minh-city,- Địa chỉ: 65 Lý Tự Trọng; Bến Nghé; Quận 1; Thành phố Hồ Chí Minh - Giờ mở cửa: Thứ ba; thứ tư; thứ năm; thứ bảy; chủ nhật: 8h - 12h; 14h - 16h30 Thứ hai và thứ sáu: 8h - 12h - Giá vé tham khảo: 40.000đ cho du khách quốc tế Khách Việt Nam được miễn phí Dinh Độc Lập được khởi công xây dựng ngày 1/7/1962 theo đồ án thiết kế của kiến trúc sư Ngô Viết Thụ.
Hồ Chí Minh,https://www.visithcmc.vn/news/top-20-places-you-need-to-visit-in-ho-chi-minh-city,Nơi đây lưu giữ những dấu mốc đáng tự hào của dân tộc trong cuộc chiến tranh bảo vệ đất nước vào thế kỷ trước. Đặc biệt là sự kiện kết thúc chiến tranh tại miền Nam; thống nhất đất nước vào ngày 30 tháng 4 năm 1975.
Hồ Chí Minh,https://www.visithcmc.vn/news/top-20-places-you-need-to-visit-in-ho-chi-minh-city,Đến năm 1976; Dinh Độc Lập được gọi là Hội trường Thống Nhất.
Hồ Chí Minh,https://www.visithcmc.vn/news/top-20-places-you-need-to-visit-in-ho-chi-minh-city,Ngày nay; khi đến tham quan Dinh Độc Lập; để tìm hiểu thêm nhiều chi tiết lịch sử thú vị; du khách có thể tham quan khu vực trưng bày thông tin và tư liệu về Dinh Norodom (1868) trước; rồi sau đó di chuyển qua khu vực tham quan phòng thông tin về toà nhà chính Dinh Độc Lập (1966) để hành trình trọn vẹn hơn. Bên trong dinh còn có cửa hàng quà lưu niệm; nhà hàng và quán cà phê để phục vụ du khách tham quan.
Hồ Chí Minh,https://www.visithcmc.vn/news/top-20-places-you-need-to-visit-in-ho-chi-minh-city,Dinh Độc Lập; 135 đường Nam Kỳ Khởi Nghĩa; Phường Bến Thành; Quận 1; Thành phố Hồ Chí Minh.Thời gian hoạt động (từ Thứ 2 đến Chủ Nhật): 8:00 – 13:00.Website: www.dinhdoclap.gov.vn - Địa chỉ: Số 135 đường Nam Kỳ Khởi Nghĩa; thành phố Hồ Chí Minh - Giờ mở cửa: 8h - 16h30 - Giá vé tham khảo: 10.000đ - 65.000đ Công viên 30/4 là một không gian xanh rộng lớn nằm ngay giữa trung tâm TPHCM. Với diện tích hơn 50ha; công viên này là nơi yêu thích để người dân địa phương và du khách tìm đến để tận hưởng không gian thoáng đãng và thư giãn. Có nhiều tiện ích như khu vui chơi trẻ em; sân bóng đá; đường đi bộ và không gian cây xanh; Công viên 30/4 được xem là  xanh của TPHCM. Đây cũng là nơi tổ chức các sự kiện âm nhạc; festival và hoạt động văn hóa thu hút đông đảo người tham gia. - Địa chỉ: Đường Lê Duẩn; Bến Nghé; Quận 1; Thành phố Hồ Chí Minh - Giờ mở cửa: Mở cửa cả ngày - Giá vé tham khảo: Miễn phí Thảo Cầm Viên Sài Gòn là một điểm đến thú vị cho những ai yêu thích động vật và thiên nhiên hoang dã.
Hồ Chí Minh,https://www.visithcmc.vn/news/top-20-places-you-need-to-visit-in-ho-chi-minh-city,Với diện tích hơn 20ha; khu vườn thú này chứa đựng hàng trăm loài động vật từ khắp nơi trên thế giới. Bạn có thể chiêm ngưỡng sự đa dạng và hấp dẫn của các loài chim; động vật bò sát; côn trùng và động vật có vú khác. Thảo Cầm Viên Sài Gòn cũng có các chương trình giáo dục và biểu diễn đặc sắc; mang đến cho du khách cơ hội khám phá và tìm hiểu về các loài động vật. Ngoài ra; khu vườn thú cũng có các khu vực xanh; hồ nước và khu vui chơi cho trẻ em; tạo nên một không gian thư giãn hoàn hảo cho cả gia đình.
Hồ Chí Minh,https://www.visithcmc.vn/news/top-20-places-you-need-to-visit-in-ho-chi-minh-city,- Địa chỉ: Số 2 Nguyễn Bỉnh Khiêm; Bến Nghé; Quận 1; Thành phố Hồ Chí Minh - Giờ mở cửa: 7h - 17h30 - Giá vé tham khảo: 40.000đ - 60.000đ Phố đi bộ Nguyễn Huệ là một trong những địa điểm nổi tiếng của TPHCM; thu hút du khách và người dân địa phương. Với không gian rộng lớn; phố đi bộ này được trang hoàng bởi hàng loạt cây xanh; đèn trang trí và những tượng điêu khắc độc đáo. Đây là nơi diễn ra nhiều hoạt động vui chơi; biểu diễn nghệ thuật và triển lãm nghệ thuật đường phố. Bạn có thể tham gia vào các hoạt động ngoài trời; ngắm nhìn những tiết mục trình diễn đặc sắc và thưởng thức những món ăn đặc sản tại các quán hàng và nhà hàng ven đường. - Địa chỉ: 75 Đường Lê Thánh Tôn; Bến Nghé; Quận 1; Thành phố Hồ Chí Minh - Giờ mở cửa: Mở cửa cả ngày - Giá vé tham khảo: Miễn phí Xem thêm Phố đi bộ Nguyễn Huệ: Vẻ Đẹp; Ẩm Thực và Trải Nghiệm tại TPHCM Nhà hát lớn thành phố là một công trình kiến trúc vĩ đại và nổi tiếng của TPHCM. Với kiến trúc hoành tráng và sang trọng; nhà hát này là nơi tổ chức các buổi biểu diễn nghệ thuật; nhạc kịch và opera đẳng cấp. Du khách có thể thưởng thức những vở kịch nổi tiếng; âm nhạc tuyệt vời và các tiết mục múa độc đáo. Nhà hát lớn thành phố không chỉ là một điểm đến văn hóa quan trọng; mà còn mang đến cho du khách trải nghiệm tuyệt vời về nghệ thuật và văn hóa của Việt Nam. - Địa chỉ: 07 Công Trường Lam Sơn; Bến Nghé; Quận 1; Thành phố Hồ Chí Minh - Giờ mở cửa: Từ thứ Hai đến thứ Sáu: 9h - 16h30 Thứ Bảy; Chủ Nhật: 9h - 12h - Giá vé xem biểu diễn: Khoảng 700.000đ/vé tùy thuộc vào chương trình biểu diễn Khu phố Tây Bùi Viện là một điểm đến rất được ưa chuộng của giới trẻ cũng như du khách quốc tế khi đặt chân đến TP.HCM; được ví là con đường “ăn chơi bậc nhất Sài Gòn”. Đây là nơi tập trung nhiều quán bar; nhà hàng; du khách có thể thưởng thức ẩm thực mới lạ; tham gia vào các buổi biểu diễn âm nhạc; các trò chơi vui nhộn; hoặc thư giãn trong không gian thoải mái của các quán cà phê. Du khách nên đến đây vào hai ngày cuối tuần để có thể tận hưởng trọn vẹn bầu không khí sôi động và nhộn nhịp của Thành phố về đêm. - Địa chỉ: Bùi Viện – Phạm Ngũ Lão – Đề Thám; Quận 1; thành phố Hồ chí Minh - Giờ mở cửa: Thứ bảy; Chủ Nhật: 19h - 2h sáng hôm sau. - Giá vé tham khảo: Miễn phí Xem thêm Khu phố tây bùi viện Sài Gòn - Sống động với phố không ngủ Địa đạo Củ Chi là một điểm du lịch nổi tiếng ở Việt Nam; nằm cách trung tâm thành phố Hồ Chí Minh khoảng 70km về hướng Tây Bắc. Ngày nay; địa đạo Củ Chi đã được bảo tồn và trở thành một điểm tham quan lịch sử hấp dẫn đặc biệt với các du khách nước ngoài. Du khách đến địa đạo Củ Chi sẽ có cơ hội trải nghiệm những hoạt động độc đáo liên quan đến cuộc sống trong địa đạo. Các hoạt động bao gồm khám phá các hầm; tham gia vào các trò chơi quân đội; rèn luyện bắn súng; trải nghiệm ăn những món ăn trong thời chiến cùng với người dân Củ Chi. - Địa chỉ: Phú Hiệp; Củ Chi; Thành phố Hồ Chí Minh - Giờ mở cửa: 7h - 17h - Giá vé tham khảo: 35.000đ Xem thêm Tham quan địa đạo Củ Chi - Bảo tàng Mỹ thuật là một viện bảo tàng nghệ thuật ấn tượng tại TP.HCM. Được thành lập từ năm 1975; bảo tàng này chứa đựng nhiều tác phẩm nghệ thuật đặc sắc của Việt Nam và thế giới. Du khách có thể tìm hiểu về lịch sử và phong cách nghệ thuật qua các triển lãm và bộ sưu tập đa dạng tại đây. Bảo tàng Mỹ thuật là điểm đến lý tưởng của rất nhiều du khách; đặc biệt là những bạn thích khám phá vẻ đẹp của các tác phẩm nghệ thuật. - Địa chỉ: 97A Phó Đức Chính; Phường Nguyễn Thái Bình; Quận 1; Thành phố Hồ Chí Minh - Giờ mở cửa: 8h - 17h - Giá vé tham khảo: 15.000đ - 30.000đ (Miễn phí: Cho trẻ em dưới 6 tuổi và người trên 60 tuổi) Nằm giữa trung tâm thành phố; Hồ Bán Nguyệt là một hồ nước lớn tại TP.HCM.
Hồ Chí Minh,https://www.visithcmc.vn/news/top-20-places-you-need-to-visit-in-ho-chi-minh-city,Điểm đặc biệt của hồ này chính là không gian yên bình và thoáng đãng mà nó mang lại. Du khách có thể tận hưởng cảnh quan hồ nước tươi mát trong lành; ngắm nhìn những đám mây trôi qua trên bầu trời xanh biếc; và thể hiện sự thư giãn trong cuộc sống hối hả của thành phố. Ngoài ra; tại Hồ Bán Nguyệt còn có các hoạt động giải trí như chèo thuyền; câu cá và tản bộ quanh hồ. - Địa chỉ: Khu đô thị mới Phú Mỹ Hưng; quận 7; thành phố Hồ Chí Minh - Giờ mở cửa: Mở cửa cả ngày - Giá vé tham khảo: Miễn phí Đọc thêm Khám phá nhanh công viên cầu Ánh Sao - Hồ Bán Nguyệt Chùa Vĩnh Nghiêm là một công trình kiến trúc tôn giáo nổi tiếng tọa lạc tại TP.HCM. Được xây dựng vào những năm 1960; ngôi chùa này là điểm đến thú vị để tham quan và tìm hiểu về đạo Phật. Chùa Vĩnh Nghiêm nổi tiếng với kiến trúc lớn và đẹp; được xây dựng theo phong cách truyền thống của Việt Nam. Du khách có thể tham quan các tòa tháp; điện và những bức tượng Phật tại chùa này để hiểu thêm về lịch sử và đạo Phật. - Địa chỉ: 339 Nam Kỳ Khởi Nghĩa; Phường 7; Quận 3; Thành phố Hồ Chí Minh - Giờ mở cửa: 7h - 21h - Giá vé tham khảo: Miễn phí Xem thêm Chùa Vĩnh Nghiêm - Nét Tinh Tế Và Tâm Linh Tại TP Hồ Chí Minh Bưu điện TPHCM; còn được gọi là Bưu điện Trung tâm Sài Gòn; là một công trình kiến trúc nổi tiếng và biểu tượng của thành phố. Kiến trúc  kết hợp giữa phong cách Châu Âu với các yếu tố kiến trúc Đông Dương; tạo nên một diện mạo độc đáo và lôi cuốn. Bên trong; bưu điện TPHCM được thiết kế sang trọng và đẹp mắt. Hành lang dẫn vào bưu điện trang trí bằng những bức tranh và tượng điêu khắc tuyệt đẹp.
Hồ Chí Minh,https://www.visithcmc.vn/news/top-20-places-you-need-to-visit-in-ho-chi-minh-city,Ngoài ra; du khách có thể ghé thăm phòng Bưu chính Việt Nam để tìm hiểu thêm về lịch sử bưu chính và viễn thông của Việt Nam. Đối với những người yêu thích con tem; bưu điện TPHCM là một điểm đến tuyệt vời để khám phá và mua sắm. Có rất nhiều tem thư đặc biệt và tem gấp sẽ mang lại cho bạn những trải nghiệm độc đáo và thú vị. - Địa chỉ: 02 Công xã Paris; Bến Nghé; Quận 1; Thành phố Hồ Chí Minh - Giờ mở cửa: 7h30 - 18h - Giá vé tham khảo: Miễn phí Xem thêm Bưu điện trung tâm Sài Gòn - Nét đẹp hài hòa giữa lòng thành phố Hồ Chí Minh Khu du lịch Văn Thánh là một khu vườn rộng lớn nằm ở quận Bình Thạnh; TP.HCM.
Hồ Chí Minh,https://www.visithcmc.vn/news/top-20-places-you-need-to-visit-in-ho-chi-minh-city,Đây là một địa điểm lý tưởng để dạo chơi và tổ chức picnic cuối tuần. Khu vườn có không gian xanh mát; được trang trí bằng các loại cây cảnh và hồ nước. Du khách có thể đi dạo trong khu vườn; tham gia các hoạt động thể thao như cầu lông; bóng đá; và thưởng thức các món ăn vặt tại các gian hàng đường phố xung quanh.
Hồ Chí Minh,https://www.visithcmc.vn/news/top-20-places-you-need-to-visit-in-ho-chi-minh-city,- Địa chỉ: 48/10 Đường Điện Biên Phủ; Phường 22; Bình Thạnh; Thành phố Hồ Chí Minh - Giờ mở cửa: 10h - 22h - Giá vé tham khảo: Miễn phí vào cổng (Du khách chỉ chi trả cho các dịch vụ khi sử dụng) Xem thêm Khu du lịch Văn Thánh - Ốc đảo thiên nhiên tuyệt đẹp giữa Sài Gòn Nhà thờ Tân Định là một công trình kiến trúc tôn giáo nổi tiếng tọa lạc ở TP.HCM.
Hồ Chí Minh,https://www.visithcmc.vn/news/top-20-places-you-need-to-visit-in-ho-chi-minh-city,Được xây dựng vào năm 1876; nhà thờ này nổi tiếng với màu hồng chủ đạo độc đáo; tạo nên vẻ đẹp đặc biệt. Du khách có thể tham quan bên trong nhà thờ để chiêm ngưỡng kiến trúc lịch sử của nó. Đây cũng là nơi tổ chức các nghi lễ tôn giáo quan trọng hàng năm; thu hút rất đông khách du lịch ghé thăm và chụp ảnh miễn phí. - Địa chỉ: 289 Hai Bà Trưng; Phường 8; Quận 3; Thành phố Hồ Chí Minh - Giờ mở cửa: Thứ Hai đến thứ Sáu: 8h - 11h30; 14h - 17h Xem thêm bài viết Khám phá chi tiết về nhà thờ Tân Định Khu du lịch Suối Tiên là một công viên giải trí lớn tọa lạc ở quận 9; TP.HCM.
Hồ Chí Minh,https://www.visithcmc.vn/news/top-20-places-you-need-to-visit-in-ho-chi-minh-city,Nơi đây có các trò chơi thú vị và tiểu cảnh đẹp mắt; thu hút rất nhiều du khách mỗi năm. Các hoạt động tại khu du lịch Suối Tiên bao gồm đi thuyền; trượt nước; đi dạo ngắm nhìn cảnh quan cũng như tận mắt thấy được nhiều động vật đáng yêu như hươu; voi; ngựa vằn;hà mã...; và tham gia các trò chơi mạo hiểm. Du khách có thể tận hưởng những giây phút vui vẻ; thư giãn cùng gia đình và bạn bè tại đây. - Địa chỉ: 120 Đường Võ Nguyên Giáp; Thành Phố; Thủ Đức; Thành phố Hồ Chí Minh - Giờ mở cửa: 7h30 - 17h - Giá vé vào cổng: 80.00đ - 150.000đ Khu phố Nhật Bản; hay còn được gọi là Little Tokyo; là một khu vực tập trung nhiều nhà hàng; quán cà phê và cửa hàng Nhật Bản tại TP.HCM. Đây là điểm đến mang đến không gian văn hóa Nhật đặc biệt; nơi du khách có thể thưởng thức các món ăn Nhật truyền thống; mua sắm các sản phẩm và trang phục Nhật Bản; và trải nghiệm văn hoá độc đáo của Nhật Bản ngay tại Việt Nam. - Địa chỉ: hẻm số 15B đường Lê Thánh Tôn; Quận 1; Thành phố Hồ Chí Minh - Giờ mở cửa: Mở cửa cả ngày - Giá vé tham khảo: Miễn phí (Du khách chỉ chi trả khi sử dụng dịch vụ) Công viên Cầu Ánh Sao là một công viên với cầu ánh sáng đẹp mắt tọa lạc ở quận 7; TP.HCM. Được thiết kế theo phong cách hiện đại và lãng mạn; công viên Cầu Ánh Sao tạo ra không gian thư giãn và lãng mạn cho người dân và du khách. Đặc điểm nổi bật của công viên này là cây cầu được trang trí với hàng ngàn đèn LED; tạo ra một hiệu ứng ánh sáng lung linh và huyền ảo vào ban đêm. Du khách có thể đi dạo trên cầu và thưởng ngoạn khung cảnh đẹp dưới lòng hồ; đồng thời tận hưởng không gian yên tĩnh và hòa mình vào không khí lãng mạn. Có nhiều điểm ngồi và khu vực picnic xung quanh công viên; cho phép du khách nghỉ ngơi và thưởng thức không gian xanh mát. Ngoài ra; công viên Cầu Ánh Sao cũng tổ chức các hoạt động giải trí như biểu diễn âm nhạc; triển lãm nghệ thuật và các buổi hòa nhạc ngoài trời. Đây là một địa điểm phổ biến để tổ chức hôn lễ; chụp ảnh cưới và kỷ niệm ngày quan trọng. - Địa chỉ: khu đô thị mới Phú Mỹ Hưng; quận 7; Thành phố Hồ Chí Minh - Giờ mở cửa: Mở cửa cả ngày (Du khách nên đến vào 17h30 là thời điểm đẹp nhất) - Giá vé tham khảo: Miễn phí Với sự đa dạng và sống động của các địa điểm này; TPHCM luôn là điểm hot phù hợp với mọi người; đảm bảo mang lại những trải nghiệm đáng nhớ cho du khách.
Hồ Chí Minh,https://www.agoda.com/vi-vn/travel-guides/vietnam/ho-chi-minh-city/essential-ho-chi-minh-city-guide-10-must-see-spots-for-first-time-visitors/,Chào mừng bạn đến với Thành phố Hồ Chí Minh; một đô thị sôi động pha trộn di sản lịch sử phong phú với nét quyến rũ hiện đại. Cho dù bạn biết đến nơi này bằng cái tên lịch sử; Sài Gòn hay tên hiện tại; thành phố này là điểm dừng chân không thể bỏ qua đối với du khách đến thăm Việt Nam. Trong hướng dẫn này; chúng tôi sẽ đề cập đến các điểm tham quan hàng đầu; thông tin chi tiết về địa phương; các địa điểm ăn uống ngon và mẹo du lịch thiết thực để giúp du khách lần đầu trải nghiệm những điều tuyệt vời nhất ở Thành phố Hồ Chí Minh. Bắt đầu cuộc phiêu lưu ở Thành phố Hồ Chí Minh của bạn tại Chợ Bến Thành; một trong những địa danh lâu đời nhất của thành phố. Tọa lạc tại Quận 1; khu chợ nhộn nhịp này là nơi lý tưởng để mua sắm; nếm thử các món ăn địa phương và trải nghiệm bầu không khí sôi động. Từ đồ thủ công truyền thống đến ẩm thực đường phố; chợ Bến Thành có đủ mọi thứ. Để tìm hiểu sâu hơn về lịch sử Việt Nam; hãy ghé thăm Bảo tàng Chứng tích Chiến tranh. Bảo tàng này mang đến cái nhìn thoáng qua về Chiến tranh Việt Nam thông qua nhiều triển lãm khác nhau; bao gồm ảnh; hiện vật và thiết bị quân sự. Đây là một chuyến tham quan cần thiết để hiểu về quá khứ của đất nước.
Hồ Chí Minh,https://www.agoda.com/vi-vn/travel-guides/vietnam/ho-chi-minh-city/essential-ho-chi-minh-city-guide-10-must-see-spots-for-first-time-visitors/,Cách chợ Bến Thành một quãng đi bộ ngắn là Nhà thờ Đức Bà Sài Gòn.
Hồ Chí Minh,https://www.agoda.com/vi-vn/travel-guides/vietnam/ho-chi-minh-city/essential-ho-chi-minh-city-guide-10-must-see-spots-for-first-time-visitors/,Được thực dân Pháp xây dựng vào cuối thế kỷ 19; nhà thờ tuyệt đẹp này là ví dụ điển hình của kiến trúc tân La Mã. Cửa sổ kính màu tuyệt đẹp và tháp chuông đôi khiến nơi đây trở thành địa điểm không thể bỏ qua. Để có một chuyến đi mạo hiểm trong ngày; hãy đến Địa đạo Củ Chi.
Hồ Chí Minh,https://www.agoda.com/vi-vn/travel-guides/vietnam/ho-chi-minh-city/essential-ho-chi-minh-city-guide-10-must-see-spots-for-first-time-visitors/,Mạng lưới đường hầm phức tạp này đóng một vai trò quan trọng trong Chiến tranh Việt Nam. Du khách có thể khám phá các đường hầm và tìm hiểu về cuộc sống của những người lính đã sử dụng chúng. Các chuyến tham quan có hướng dẫn cung cấp bối cảnh lịch sử và trải nghiệm thực tế.
Hồ Chí Minh,https://www.agoda.com/vi-vn/travel-guides/vietnam/ho-chi-minh-city/essential-ho-chi-minh-city-guide-10-must-see-spots-for-first-time-visitors/,Chùa Ngọc Hoàng nằm ở Quận 1; là viên ngọc ẩn của Thành phố Hồ Chí Minh. Ngôi chùa Đạo giáo này nổi tiếng với kiến trúc trang trí công phu và bầu không khí yên bình. Đó là một nơi hoàn hảo cho những ai muốn trải nghiệm khía cạnh tâm linh của thành phố. Để có cái nhìn toàn cảnh thành phố; hãy ghé thăm Tháp tài chính Bitexco. Skydeck trên tầng 49 mang đến tầm nhìn 360 độ toàn thành phố Hồ Chí Minh. Đây là địa điểm lý tưởng để chụp ảnh và cảm nhận sự rộng lớn của thành phố. Dinh Độc Lập hay còn gọi là Hội trường Thống Nhất là di tích lịch sử nơi Chiến tranh Việt Nam chính thức kết thúc.
Hồ Chí Minh,https://www.agoda.com/vi-vn/travel-guides/vietnam/ho-chi-minh-city/essential-ho-chi-minh-city-guide-10-must-see-spots-for-first-time-visitors/,Kiến trúc và thiết kế nội thất của tòa nhà phản ánh tính thẩm mỹ của những năm 1960; mang đến cái nhìn độc đáo về quá khứ.
Hồ Chí Minh,https://www.agoda.com/vi-vn/travel-guides/vietnam/ho-chi-minh-city/essential-ho-chi-minh-city-guide-10-must-see-spots-for-first-time-visitors/,Bạn có thể thuê hướng dẫn du lịch để được cung cấp thông tin lịch sử chi tiết và đáng giá.
Hồ Chí Minh,https://www.agoda.com/vi-vn/travel-guides/vietnam/ho-chi-minh-city/essential-ho-chi-minh-city-guide-10-must-see-spots-for-first-time-visitors/,Xem buổi biểu diễn tại Nhà Hát Lớn Sài Gòn; một tòa nhà thuộc địa Pháp xinh đẹp ở trung tâm Quận 1. Địa điểm này tổ chức nhiều chương trình biểu diễn; từ các buổi biểu diễn truyền thống của Việt Nam đến các vở kịch đương đại.
Hồ Chí Minh,https://www.agoda.com/vi-vn/travel-guides/vietnam/ho-chi-minh-city/essential-ho-chi-minh-city-guide-10-must-see-spots-for-first-time-visitors/,Đó là một trải nghiệm văn hóa tuyệt vời cho du khách. Để có cuộc sống về đêm sôi động; hãy đến Phố Bùi Viện.
Hồ Chí Minh,https://www.agoda.com/vi-vn/travel-guides/vietnam/ho-chi-minh-city/essential-ho-chi-minh-city-guide-10-must-see-spots-for-first-time-visitors/,Khu vực nhộn nhịp này; được gọi là Phố Tây ba lô; có rất nhiều quán bar; nhà hàng và địa điểm biểu diễn nhạc sống.
